{
  "schema_version": 1,
  "manifest_kind": "jawiki_tier_a_source_spans",
  "verification_status": "verified",
  "snapshot_date": "2026-08-01",
  "jawiki_local_sha256": "4822a58b180fc0057ce6f64325f11c34fe6396fb5ed2e4a04eaf7a9658acc12d",
  "dictionary_index_sha256": "4a3b04ea02ec601a1b23eedd6eb4c19582cd36c39f098c2d0ad61b259fd6c072",
  "extractor_git_sha": "7cdb51f77875caab8be25683fc3bf174c0e91325",
  "cleaner_version": "conservative_wikitext_v1",
  "config": {
    "sample_modulus": 1000000,
    "sample_slots": 60,
    "max_records": 100000,
    "max_records_per_page": 8,
    "max_output_bytes": 268435456,
    "min_sentence_chars": 4,
    "max_sentence_chars": 512,
    "min_surface_chars": 1,
    "max_surface_chars": 64
  },
  "eligible_dictionary_surface_count": 335218,
  "record_count": 40703,
  "content_sha256": "8b3067836e894b93142f502157d1a65bcb34da277b81111388d8b18220fad727",
  "counts": {
    "dictionary_matches": 673677189,
    "matches_not_sampled": 673636486,
    "pages_hit_record_bound": 3,
    "pages_non_main": 636071,
    "pages_processed": 1512214,
    "pages_redirect": 952212,
    "pages_total": 3100497,
    "paragraph_too_long": 290,
    "paragraphs_accepted": 14737307,
    "residual_markup": 103086,
    "sentences_accepted": 32980716,
    "sentences_outside_bounds": 1768487,
    "unbalanced_link": 94862,
    "unbalanced_template": 86558
  },
  "raw_text_in_report": false
}
